{
  "$schema": "https://json-schema.org/draft/2020-12/schema",
  "$id": "ssdf-evals-scorecard-v1",
  "title": "SSDF eval scorecard (contract v1)",
  "type": "object",
  "required": ["schema_version", "run_id", "model", "runner", "tier",
               "principal", "corpus_version", "scored_at", "questions", "rollups"],
  "additionalProperties": false,
  "properties": {
    "schema_version": {"const": 1},
    "run_id": {"type": "string"},
    "model": {"type": "string"},
    "runner": {"type": "string"},
    "tier": {"enum": ["sovereign", "public"]},
    "principal": {"type": "string"},
    "corpus_version": {"type": "string"},
    "scored_at": {"type": "string", "format": "date-time"},
    "questions": {
      "type": "array",
      "items": {
        "type": "object",
        "required": ["id", "pass", "reasons", "predicate_detail", "tools_observed"],
        "additionalProperties": false,
        "properties": {
          "id": {"type": "string"},
          "pass": {"type": "boolean"},
          "reasons": {"type": "array", "items": {"type": "string"}},
          "predicate_detail": {"type": "object"},
          "tools_observed": {"type": "array", "items": {"type": "string"}}
        }
      }
    },
    "rollups": {
      "type": "object",
      "required": ["total", "passed", "by_category", "by_difficulty", "by_tier"],
      "additionalProperties": false,
      "properties": {
        "total": {"type": "integer"},
        "passed": {"type": "integer"},
        "by_category": {"type": "object",
          "additionalProperties": {"$ref": "#/$defs/bucket"}},
        "by_difficulty": {"type": "object",
          "additionalProperties": {"$ref": "#/$defs/bucket"}},
        "by_tier": {"type": "object",
          "additionalProperties": {"$ref": "#/$defs/bucket"}}
      }
    }
  },
  "$defs": {
    "bucket": {
      "type": "object",
      "required": ["total", "passed"],
      "additionalProperties": false,
      "properties": {
        "total": {"type": "integer"},
        "passed": {"type": "integer"}
      }
    }
  }
}
