{
  "schema_version": 1,
  "run_id": "qwen3:8b-sovereign-2026-06-19T17:19:29Z",
  "model": "qwen3:8b",
  "runner": "ssdf-eval-runner/qwen",
  "tier": "sovereign",
  "principal": "eval-qwen",
  "corpus_version": "2e9202e6d0783848fa3dabe932ca8142467bdee1",
  "scored_at": "2026-06-19T17:19:45Z",
  "questions": [
    {
      "id": "reach-rule-trust-untrust",
      "pass": true,
      "reasons": [],
      "predicate_detail": {
        "agent": [
          "allow-approved-dns"
        ],
        "reference": [
          "allow-approved-dns"
        ]
      },
      "tools_observed": [
        "explain_access"
      ]
    },
    {
      "id": "reach-firewall-attribution",
      "pass": true,
      "reasons": [],
      "predicate_detail": {
        "agent": [
          "panosvm"
        ],
        "reference": [
          "panosvm"
        ]
      },
      "tools_observed": [
        "configured_policies",
        "explain_access"
      ]
    },
    {
      "id": "reach-configured-policy-count-panosvm",
      "pass": true,
      "reasons": [],
      "predicate_detail": {
        "agent": 8.0,
        "reference": 8.0,
        "allowed": 0.0
      },
      "tools_observed": [
        "configured_policies",
        "explain_access"
      ]
    },
    {
      "id": "reach-busiest-pair-panosvm",
      "pass": false,
      "reasons": [
        "predicate: exact set mismatch"
      ],
      "predicate_detail": {
        "agent": [
          "198.51.100.100 \u2192 10.64.0.50"
        ],
        "reference": [
          "203.0.113.20->198.51.100.1"
        ]
      },
      "tools_observed": [
        "configured_policies"
      ]
    },
    {
      "id": "flows-top-talkers-24h",
      "pass": true,
      "reasons": [],
      "predicate_detail": {
        "agent": [
          "203.0.113.20",
          "192.0.2.20",
          "198.51.100.100"
        ],
        "reference": [
          "203.0.113.20",
          "192.0.2.20",
          "198.51.100.100"
        ],
        "overlap": 3
      },
      "tools_observed": [
        "top_talkers"
      ]
    },
    {
      "id": "flows-event-count-24h",
      "pass": false,
      "reasons": [
        "predicate: |10.0-13644.0| > 1364.4"
      ],
      "predicate_detail": {
        "agent": 10.0,
        "reference": 13644.0,
        "allowed": 1364.4
      },
      "tools_observed": [
        "query_flows"
      ]
    },
    {
      "id": "flows-providers-7d",
      "pass": false,
      "reasons": [
        "runner error: no JSON parsed"
      ],
      "predicate_detail": {},
      "tools_observed": []
    },
    {
      "id": "flows-top-dest-ports-24h",
      "pass": false,
      "reasons": [
        "runner error: no JSON parsed"
      ],
      "predicate_detail": {},
      "tools_observed": []
    },
    {
      "id": "flows-paloalto-actions-7d",
      "pass": false,
      "reasons": [
        "predicate: exact set mismatch"
      ],
      "predicate_detail": {
        "agent": [
          "system_auth",
          "system_general"
        ],
        "reference": [
          "config_0",
          "flow_drop",
          "flow_end",
          "system_app-cloud-engine",
          "system_auth",
          "system_ctd-agent",
          "system_device-telemetry",
          "system_dhcp",
          "system_dns-security",
          "system_dnsproxy",
          "system_fips",
          "system_general",
          "system_hw",
          "system_iot",
          "system_ntpd",
          "system_port",
          "system_ras",
          "system_routing",
          "system_satd",
          "system_security",
          "system_ssh",
          "system_sslmgr",
          "system_url-filtering",
          "system_userid",
          "system_vpn",
          "system_wildfire"
        ]
      },
      "tools_observed": [
        "query_flows"
      ]
    },
    {
      "id": "flows-total-bytes-7d",
      "pass": false,
      "reasons": [
        "runner error: no JSON parsed"
      ],
      "predicate_detail": {},
      "tools_observed": []
    },
    {
      "id": "topo-locate-labgen",
      "pass": true,
      "reasons": [],
      "predicate_detail": {
        "agent": [
          "panosvm"
        ],
        "reference": [
          "panosvm"
        ],
        "overlap": 1
      },
      "tools_observed": [
        "observed_by"
      ]
    },
    {
      "id": "topo-entity-kind-panosvm",
      "pass": true,
      "reasons": [],
      "predicate_detail": {
        "expected": {
          "kind": "device",
          "role": "firewall"
        },
        "agent": {
          "kind": "device",
          "role": "firewall"
        }
      },
      "tools_observed": [
        "get_entity",
        "observed_by",
        "topology_snapshot"
      ]
    },
    {
      "id": "topo-firewall-inventory",
      "pass": true,
      "reasons": [],
      "predicate_detail": {
        "expected": {
          "firewalls": [
            "panosvm",
            "vSRX-test10"
          ]
        },
        "agent": {
          "firewalls": [
            "vSRX-test10",
            "panosvm"
          ]
        }
      },
      "tools_observed": [
        "get_entity",
        "topology_snapshot"
      ]
    },
    {
      "id": "topo-path-labgen-gateway",
      "pass": true,
      "reasons": [],
      "predicate_detail": {
        "expected": {
          "path_exists": true
        },
        "agent": {
          "path_exists": true
        }
      },
      "tools_observed": [
        "configured_policies",
        "find_path",
        "topology_snapshot"
      ]
    },
    {
      "id": "change-vsrx-rule-names",
      "pass": true,
      "reasons": [],
      "predicate_detail": {
        "agent": [
          "baseline-permit"
        ],
        "reference": [
          "baseline-permit"
        ]
      },
      "tools_observed": [
        "configured_policies",
        "find_path"
      ]
    },
    {
      "id": "change-paloalto-earliest-event",
      "pass": false,
      "reasons": [
        "predicate: exact set mismatch"
      ],
      "predicate_detail": {
        "agent": [
          "2026-06-06"
        ],
        "reference": [
          "2026-06-07"
        ]
      },
      "tools_observed": [
        "configured_policies",
        "describe_schema"
      ]
    },
    {
      "id": "change-paloalto-freshness",
      "pass": false,
      "reasons": [
        "predicate: predicate error: 'epoch'"
      ],
      "predicate_detail": {},
      "tools_observed": [
        "describe_schema",
        "query_flows"
      ]
    },
    {
      "id": "honesty-okta-logins",
      "pass": true,
      "reasons": [],
      "predicate_detail": {},
      "tools_observed": []
    },
    {
      "id": "honesty-packet-captures",
      "pass": true,
      "reasons": [],
      "predicate_detail": {},
      "tools_observed": []
    },
    {
      "id": "honesty-device-metrics",
      "pass": true,
      "reasons": [],
      "predicate_detail": {},
      "tools_observed": []
    },
    {
      "id": "honesty-config-change",
      "pass": true,
      "reasons": [],
      "predicate_detail": {},
      "tools_observed": []
    },
    {
      "id": "honesty-identity-user",
      "pass": true,
      "reasons": [],
      "predicate_detail": {},
      "tools_observed": []
    }
  ],
  "rollups": {
    "total": 22,
    "passed": 14,
    "by_category": {
      "reachability": {
        "total": 4,
        "passed": 3
      },
      "flows": {
        "total": 6,
        "passed": 1
      },
      "topology": {
        "total": 4,
        "passed": 4
      },
      "change": {
        "total": 3,
        "passed": 1
      },
      "honesty": {
        "total": 5,
        "passed": 5
      }
    },
    "by_difficulty": {
      "medium": {
        "total": 9,
        "passed": 7
      },
      "hard": {
        "total": 5,
        "passed": 2
      },
      "easy": {
        "total": 8,
        "passed": 5
      }
    },
    "by_tier": {
      "sovereign": {
        "total": 18,
        "passed": 10
      },
      "both": {
        "total": 4,
        "passed": 4
      }
    }
  }
}
